{
  "$schema": "https://json-schema.org/draft/2020-12/schema",
  "$id": "https://rattleapp.de/schemas/offer-template.schema.json",
  "title": "Rattle Document Template (Offer / Quote / Custom / CCMS)",
  "description": "Output of the rattle-document-templates workflow. Describes a document template with chapters and attachments. Honours the doc_type contract from GET /documents/doc-types. For technical documentations (doc_type=technical_doc) use the dedicated rattle-techdoc skill instead — it emits a richer 15-chapter scaffold against the same template surface.",
  "type": "object",
  "required": ["template_name", "chapters"],
  "properties": {
    "template_name": { "type": "string", "minLength": 1 },
    "doc_type": {
      "enum": ["offer", "quote", "custom", "ccms", "offers", "quotes"],
      "description": "Must match an entry from app/services/document_types.py: 'offer', 'quote', 'custom', or 'ccms' (legacy plurals 'offers'/'quotes' are also accepted on writes). 'technical_doc' is intentionally excluded here — that doc_type uses the techdoc-template schema in skills/rattle-techdoc/. The string 'datasheet' is NOT a backend doc_type; datasheet-style assets ride on 'custom'."
    },
    "product_id": { "type": ["integer", "null"] },
    "chapters": {
      "type": "array",
      "minItems": 1,
      "items": { "$ref": "#/$defs/chapter" }
    },
    "notes": {
      "type": "array",
      "items": { "type": "string" }
    }
  },
  "additionalProperties": false,
  "$defs": {
    "chapter": {
      "type": "object",
      "required": ["slug", "title", "attachments"],
      "properties": {
        "slug": {
          "type": "string",
          "pattern": "^[a-z0-9][a-z0-9-]*$",
          "description": "Unique within the template. Lowercase kebab-case."
        },
        "title": { "type": "string", "minLength": 1 },
        "order_index": { "type": "integer", "minimum": 0 },
        "attachments": {
          "type": "array",
          "items": { "$ref": "#/$defs/attachment" }
        }
      },
      "additionalProperties": false
    },
    "attachment": {
      "type": "object",
      "anyOf": [
        { "required": ["content_block_id"] },
        { "required": ["dynamic_key"] },
        { "required": ["content_block_proposal"] }
      ],
      "properties": {
        "content_block_id": {
          "type": ["integer", "null"],
          "description": "Existing content block id. Resolve system dynamic blocks by paginating GET /documents/content-blocks?search=dynamic: and matching the response's is_dynamic=true && key='dynamic:<name>' entry — the route does NOT honour ?is_dynamic= as a query param."
        },
        "dynamic_key": {
          "type": ["string", "null"],
          "description": "Convenience: 'dynamic:document_configuration' etc. The builder resolves this to a content_block_id at execution time."
        },
        "content_block_proposal": {
          "type": "object",
          "description": "Used only when proposing a NEW static content block (not a wrapper around a dynamic key — that violates use-system-dynamic-blocks).",
          "properties": {
            "title": { "type": "string", "minLength": 1 },
            "key":   { "type": "string" },
            "locales": {
              "type": "array",
              "items": { "type": "object" }
            }
          }
        },
        "is_required": { "type": "boolean" },
        "is_active":   { "type": "boolean" },
        "order_index": { "type": "integer", "minimum": 0 }
      },
      "additionalProperties": false
    }
  }
}
