{
  "template_name": "Widget Pro — Offer",
  "doc_type": "offer",
  "product_id": null,
  "chapters": [
    {
      "slug": "product-overview",
      "title": "Product Overview",
      "order_index": 0,
      "attachments": [
        {
          "content_block_id": null,
          "content_block_proposal": {
            "title": "Widget Pro — Overview",
            "key": "widget-pro-overview",
            "locales": [
              {
                "locale": "de",
                "blocks": [
                  {"type": "paragraph", "data": {"text": "Widget Pro is a configurable industrial widget designed for…"}}
                ]
              }
            ]
          },
          "is_required": false,
          "order_index": 0
        }
      ]
    },
    {
      "slug": "configuration",
      "title": "Configuration",
      "order_index": 1,
      "attachments": [
        {
          "content_block_id": null,
          "dynamic_key": "dynamic:document_configuration",
          "is_required": true,
          "order_index": 0
        }
      ]
    },
    {
      "slug": "pricing",
      "title": "Pricing",
      "order_index": 2,
      "attachments": [
        {
          "content_block_id": null,
          "dynamic_key": "dynamic:document_pricing",
          "is_required": true,
          "order_index": 0
        }
      ]
    }
  ],
  "notes": [
    "Resolve dynamic_key 'dynamic:document_configuration' to its content_block_id by paginating GET /documents/content-blocks?search=dynamic:document_configuration and filtering on is_dynamic=true && key='dynamic:document_configuration' client-side (the route does NOT honour ?is_dynamic= as a query param).",
    "Resolve dynamic_key 'dynamic:document_pricing' the same way. The offer doc_type's default_layout (app/services/document_types.py) ships dynamic:document_pricing for the pricing chapter; dynamic:document_line_items belongs to the quote doc_type instead — verify against GET /documents/doc-types before publishing."
  ]
}
